{
  "id": "aa3cad99-cc71-40cb-8fd8-7e51c190e46f",
  "slug": "john-lewis-of-hungerford-manchester-manchester",
  "business_name": "John Lewis of Hungerford Manchester",
  "category": "Premium Bespoke Kitchen Company",
  "primary_trade": "kitchen_manufacturer",
  "address_line_1": null,
  "address_line_2": null,
  "town": "Manchester",
  "county": null,
  "postcode": null,
  "country": "United Kingdom",
  "telephone": null,
  "website": null,
  "email": null,
  "opening_hours": null,
  "description": null,
  "services": [],
  "tags": [],
  "google_rating": null,
  "google_review_count": null,
  "google_maps_url": null,
  "latitude": null,
  "longitude": null,
  "enrichment_status": "stub",
  "last_verified_at": null,
  "status": "listed",
  "claimed": false,
  "verified": false,
  "visibility": "public",
  "photos": [],
  "cover_image": null,
  "source": "philip_manual_seed",
  "imported_at": "2026-08-04T03:30:00Z"
}
