{
  "id": "f1991e0c-9060-4b17-a58c-453c44cdd5fc",
  "slug": "kitchen-solutions-birmingham-birmingham",
  "business_name": "Kitchen Solutions Birmingham",
  "category": "Independent Kitchen Designer",
  "primary_trade": "kitchen_designer",
  "address_line_1": null,
  "address_line_2": null,
  "town": "Birmingham",
  "county": null,
  "postcode": null,
  "country": "United Kingdom",
  "telephone": null,
  "website": null,
  "email": null,
  "opening_hours": null,
  "description": null,
  "services": [],
  "tags": [],
  "google_rating": null,
  "google_review_count": null,
  "google_maps_url": null,
  "latitude": null,
  "longitude": null,
  "enrichment_status": "stub",
  "last_verified_at": null,
  "status": "listed",
  "claimed": false,
  "verified": false,
  "visibility": "public",
  "photos": [],
  "cover_image": null,
  "source": "philip_manual_seed",
  "imported_at": "2026-08-04T03:30:00Z"
}
