{
  "id": "bab573fb-1b96-4e9c-82e5-f7be8f6cc944",
  "slug": "ashley-ann-plymouth-plymouth",
  "business_name": "Ashley Ann Plymouth",
  "category": "Independent Kitchen Designer",
  "primary_trade": "kitchen_designer",
  "address_line_1": null,
  "address_line_2": null,
  "town": "Plymouth",
  "county": null,
  "postcode": null,
  "country": "United Kingdom",
  "telephone": null,
  "website": null,
  "email": null,
  "opening_hours": null,
  "description": null,
  "services": [],
  "tags": [],
  "google_rating": null,
  "google_review_count": null,
  "google_maps_url": null,
  "latitude": null,
  "longitude": null,
  "enrichment_status": "stub",
  "last_verified_at": null,
  "status": "listed",
  "claimed": false,
  "verified": false,
  "visibility": "public",
  "photos": [],
  "cover_image": null,
  "source": "philip_manual_seed",
  "imported_at": "2026-08-04T03:30:00Z"
}
