{
  "id": "018f0a1d-f7da-4216-9fd9-3471a5f3b6dc",
  "slug": "euro-stairs-ltd-walsall",
  "business_name": "Euro Stairs Ltd",
  "category": "Staircase Manufacturer",
  "primary_trade": "staircase_manufacturer",
  "address_line_1": "55 Bath Street",
  "address_line_2": null,
  "town": "Walsall",
  "county": "West Midlands",
  "postcode": "WS1 3BZ",
  "country": "United Kingdom",
  "telephone": "+44 7725 949305",
  "website": null,
  "email": null,
  "opening_hours": null,
  "description": "Euro Stairs Ltd designs, manufactures, and installs bespoke contemporary staircases for residential and commercial properties throughout the West Midlands. The company specialises in floating staircases, steel staircases, glass balustrades, and modern architectural staircase solutions, combining structural steel with premium timber finishes.",
  "services": [
    "Bespoke Staircases",
    "Contemporary Staircases",
    "Floating Staircases",
    "Steel Staircases",
    "Glass Staircases",
    "Timber Staircases",
    "Oak Staircases",
    "Feature Staircases",
    "Staircase Design",
    "Staircase Manufacturing",
    "Staircase Installation",
    "Glass Balustrades",
    "Steel Fabrication",
    "Architectural Staircases",
    "Residential & Commercial Staircases"
  ],
  "google_rating": 5.0,
  "google_review_count": 59,
  "google_maps_url": null,
  "latitude": null,
  "longitude": null,
  "tags": [
    "bespoke-staircases",
    "floating-staircases",
    "steel-staircases",
    "glass-staircases",
    "modern-staircases",
    "architectural-staircases",
    "feature-staircases",
    "oak-staircases",
    "glass-balustrades",
    "steel-fabrication",
    "walsall-staircases",
    "west-midlands-staircases"
  ],
  "status": "listed",
  "claimed": false,
  "verified": false,
  "visibility": "public",
  "photos": [],
  "cover_image": null,
  "source": "google_business_manual_paste",
  "imported_at": "2026-07-27T12:00:28Z"
}
