{
  "id": "018f0a1c-d5b8-40f4-9451-125f83d194ba",
  "slug": "ddc-london-ltd-london",
  "business_name": "DDC London Ltd",
  "category": "Luxury Staircase Designer & Manufacturer",
  "primary_trade": "staircase_manufacturer",
  "address_line_1": "Millbank Tower, 1st Floor Citibase, 21–24 Millbank",
  "address_line_2": null,
  "town": "London",
  "county": "Greater London",
  "postcode": "SW1P 4QP",
  "country": "United Kingdom",
  "telephone": "+44 20 8004 9635",
  "website": "https://www.ddclondon.com",
  "email": null,
  "opening_hours": null,
  "description": "DDC London Ltd is a luxury staircase design and manufacturing company specialising in bespoke architectural staircases, floating staircases, glass staircases, steel staircases, and premium interior feature staircases for residential and commercial developments throughout London and the United Kingdom.",
  "services": [
    "Bespoke Staircases",
    "Floating Staircases",
    "Glass Staircases",
    "Steel Staircases",
    "Oak Staircases",
    "Cantilever Staircases",
    "Feature Staircases",
    "Contemporary Staircases",
    "Architectural Staircases",
    "Glass Balustrades",
    "Steel Balustrades",
    "Staircase Design",
    "Staircase Manufacturing",
    "Staircase Installation"
  ],
  "google_rating": 4.9,
  "google_review_count": 51,
  "google_maps_url": null,
  "latitude": null,
  "longitude": null,
  "tags": [
    "luxury-staircases",
    "floating-staircases",
    "glass-staircases",
    "steel-staircases",
    "oak-staircases",
    "modern-staircases",
    "architectural-staircases",
    "interior-design",
    "balustrades",
    "handrails",
    "feature-staircases",
    "london-staircases"
  ],
  "status": "listed",
  "claimed": false,
  "verified": false,
  "visibility": "public",
  "photos": [],
  "cover_image": null,
  "source": "google_business_manual_paste",
  "imported_at": "2026-07-27T12:00:10Z"
}
